{
  "schema": "scopa.slice-definition.v1",
  "sliceId": "S9-codex-clean",
  "allowedPaths": [
    "workspace/**"
  ],
  "amendmentPath": ".scopa/amendment.json",
  "gates": [
    {
      "id": "fixture-gate",
      "command": [
        "node",
        "-e",
        "process.exit(0)"
      ],
      "cwd": ".",
      "timeoutMs": 5000
    }
  ],
  "nonGoals": [
    "No writes outside workspace",
    "No Codex-native mutation tools"
  ],
  "stopCondition": {
    "kind": "all-gates-pass"
  }
}
